{
 "cell": [
  512,
  640
 ],
 "scale": 0.0322,
 "cloak": true,
 "parts": {
  "head": {
   "pivot": [
    257.9,
    486.20000000000005
   ],
   "src": "parts/head.png",
   "size": 1.0
  },
  "torso": {
   "pivot": [
    311.9,
    476.29999999999995
   ],
   "joints": {
    "neck": [
     279.5,
     210.9
    ],
    "shoulderN": [
     276.2,
     255.8
    ],
    "shoulderF": [
     270.2,
     255.8
    ],
    "cape": [
     241.9,
     210.9
    ]
   },
   "src": "parts/torso.png",
   "size": 0.8
  },
  "hips": {
   "pivot": [
    233.4,
    317.1
   ],
   "joints": {
    "waist": [
     232.1,
     233.8
    ],
    "hipN": [
     236.4,
     317.1
    ],
    "hipF": [
     224.4,
     317.1
    ]
   },
   "src": "parts/hips.png",
   "size": 0.8
  },
  "cape": {
   "pivot": [
    255.8,
    108.1
   ],
   "src": "parts/cape.png",
   "size": 0.8
  },
  "upperArm": {
   "pivot": [
    346.5,
    252
   ],
   "joints": {
    "elbow": [
     248.5,
     452.2
    ]
   },
   "src": "parts/upperArm.png",
   "size": 0.8
  },
  "foreArm": {
   "pivot": [
    275.5,
    177.5
   ],
   "joints": {
    "hand": [
     260.2,
     460
    ]
   },
   "src": "parts/foreArm.png",
   "size": 0.82
  },
  "thigh": {
   "pivot": [
    197.7,
    144.7
   ],
   "joints": {
    "knee": [
     232.5,
     461.7
    ]
   },
   "src": "parts/thigh.png",
   "size": 0.75
  },
  "shin": {
   "pivot": [
    269.7,
    179.8
   ],
   "joints": {
    "sole": [
     208.5,
     510
    ]
   },
   "src": "parts/shin.png",
   "size": 0.75
  }
 },
 "weapon": {
  "src": "weapon_cut.png",
  "cell": [
   212,
   947
  ],
  "grip": [
   105.3,
   134.9
  ],
  "rot": 0,
  "tip": [
   16.5,
   931
  ],
  "size": 0.62
 },
 "ref": {
  "src": "full_side_key.png",
  "foot": [
   518.5,
   1449
  ],
  "k": 1
 }
}